{
  "bundle_refs": [
    {
      "artifact_role": "research_design",
      "bundle_path": "fixtures/synthetic/research-design",
      "bundle_ref_id": "rs-bundle-ref-11111111111111111111111111111111",
      "expected_ids": {
        "plan_id": "research-plan-0123456789abcdef"
      },
      "expected_manifest_sha256": "sha256:1111111111111111111111111111111111111111111111111111111111111111",
      "manifest_path": "research-design-run-manifest.json",
      "required": true,
      "skill_name": "synthetic-research-design",
      "skill_version": "0.1.0"
    },
    {
      "artifact_role": "macro_data",
      "bundle_path": "fixtures/synthetic/macro-data",
      "bundle_ref_id": "rs-bundle-ref-22222222222222222222222222222222",
      "expected_ids": {
        "evidence_id": "tsd-input-evidence-1afbb5cbe867beb4182310bacc1c1a86"
      },
      "expected_manifest_sha256": "sha256:2222222222222222222222222222222222222222222222222222222222222222",
      "manifest_path": "input-evidence-manifest.json",
      "required": true,
      "skill_name": "synthetic-data-evidence",
      "skill_version": "0.1.0"
    },
    {
      "artifact_role": "estimator",
      "bundle_path": "fixtures/synthetic/estimator",
      "bundle_ref_id": "rs-bundle-ref-33333333333333333333333333333333",
      "expected_ids": {
        "run_id": "tsd-run-47c8f67cbc8772d6b7eb64b7f6db520d"
      },
      "expected_manifest_sha256": "sha256:3333333333333333333333333333333333333333333333333333333333333333",
      "manifest_path": "run-manifest.json",
      "required": true,
      "skill_name": "synthetic-estimator",
      "skill_version": "0.1.0"
    },
    {
      "artifact_role": "robustness_audit",
      "bundle_path": "fixtures/synthetic/robustness-audit",
      "bundle_ref_id": "rs-bundle-ref-44444444444444444444444444444444",
      "expected_ids": {
        "run_id": "ra-run-7f56707a01380d7ba7e7b7b7b9be043a"
      },
      "expected_manifest_sha256": "sha256:4444444444444444444444444444444444444444444444444444444444444444",
      "manifest_path": "run-manifest.json",
      "required": true,
      "skill_name": "synthetic-robustness-audit",
      "skill_version": "0.1.0"
    }
  ],
  "external_sources": [],
  "output_policy": {
    "allow_claim_upgrade": false,
    "allow_numeric_extraction_from_markdown": false,
    "copy_evidence_files": true,
    "expose_audit_files_as_primary_output": false,
    "include_runtime_logs": true,
    "primary_output": "research-report.md",
    "recompute_estimates": false,
    "regenerate_figures": false
  },
  "release_context": "local_review",
  "render_policy": {
    "authoritative_report_format": "markdown",
    "execute_code": false,
    "optional_renderer": "none",
    "supporting_formats": [
      "csv",
      "png"
    ]
  },
  "report_language": "zh-CN",
  "request_id": "rs-request-11111111111111111111111111111111",
  "research_title": "合成测试中的货币政策冲击与季度通胀动态路径",
  "schema_version": "0.1.0"
}
